{
  "schema_version": "2.0",
  "run_id": "example-run-001",
  "big_task_id": "TASK-A",
  "phase_id": "TASK-A-P01",
  "phase_characteristics": {
    "difficulty": "ordinary",
    "importance": "medium",
    "ambiguity": "low",
    "reversibility": "easy",
    "phase_maturity": "stable_foundation"
  },
  "preferred_route": "agy_flash_high",
  "minimum_tier": 1,
  "acceptable_routes": [
    "agy_flash_high",
    "agy_pro_high",
    "claude_subscription_sonnet"
  ],
  "unacceptable_routes": [],
  "required_families": [],
  "routing_reason": [
    "The architecture and interface are already fixed.",
    "The remaining implementation follows an established bounded pattern.",
    "The phase has a clean rollback and independent review boundary."
  ],
  "frontier_justification": null,
  "escalation_conditions": [
    "A shared interface must change.",
    "The implementation reveals non-local state coupling.",
    "Targeted validation fails outside the owned surface."
  ],
  "deescalation_conditions": [],
  "review_class": "routine_independent",
  "expected_budget_class": "small",
  "capacity_snapshot_id": "caps-replace-with-current-host-snapshot"
}
